url,article_title,article_id,author,view_number,score,summary
https://www.webtoons.com/zh-hant/local/seoul-playbook/list?title_no=3639,首爾流放生活,list?title_no=3639,Emery Cho ,"255,612",9.08,無法無天的台灣富二代——簡書豪，因為玩得太過火。讓家裡的人忍無可忍，於是決定將他『流放』到首爾郊區一處平民家一年。沒有錢又不會韓文的簡書豪該怎麼度過這一年？
https://www.webtoons.com/zh-hant/local/match-the-string/list?title_no=3637,牽紅線：Match the string,list?title_no=3637,許小檷 ,"233,842",9.04,「我死了？還成了月老實習生？可是…可是！我母胎單身耶！」完全沒戀愛經驗的陸筱霏，周旋在月老西淵以及擁有陰陽眼的青年卓旭東之間，她要如何幫助信眾的戀情以及正視自己即將萌芽的愛情呢？
https://www.webtoons.com/zh-hant/romance/onsaemiro/list?title_no=2086,溫塞米羅的愛,list?title_no=2086,YeoWoo / SaMoon ,258萬,9.64,志向是演員的海莉為了當上電視劇《無影塔》的女主角「阿斯女」，在徵選前特地到國立扶餘博物館參觀了百濟時期的文物「金銅大香爐」，沒想到竟喚醒沉睡爐中的天神…她和天神的緣分始於何時呢？
https://www.webtoons.com/zh-hant/heartwarming/youyu/list?title_no=3138,魷魚也能談戀愛嗎?,list?title_no=3138,moondance / jellyfish ,"501,800",8.44,一隻為了追尋真愛而逃出大海的浪漫魷魚！一場跌跌撞撞的人類社會適應記！
https://www.webtoons.com/zh-hant/western-palace/agatha/list?title_no=2824,艾嘉莎王妃,list?title_no=2824,Lee da in ,"790,928",8.90,「愛上你，是我的罪過… 」​憧憬著能與摯愛擁有無拘無束、自由人生的王妃—艾嘉莎，卻被蒙在鼓裡地活到現在，那些隱密地被掩瞞住的王國秘密，正一一顯露在她眼前…​黑暗中迎面而來的真相最後。背叛與暗鬥、渴望與愛情、人性的苦惱與選擇…究竟這個女人能不被擊倒，緊抓住黎明的曙光嗎？
https://www.webtoons.com/zh-hant/romance/secretary-cha/list?title_no=3134,征服我吧，車祕書,list?title_no=3134,Ghost Writer / hongju ,"510,136",8.57,收養死去姊姊留下來的女兒，母胎單身卻成為未婚媽媽的車英璦。為了和女兒過上安定的生活，不惜身兼數職，過著勞碌的日子。某一天機會來了！如果可以讓無賴富二代脫胎換骨，就能獲得3億!?好不容易讓擁有姣好的外貌和身材，行為卻像個混混的富二代姜主元變得老實一點，他卻說喜歡上了英璦，這該如何是好？只為了錢而過著勞碌生活的英璦，在3億韓元與愛情之間無法做出抉擇…
https://www.webtoons.com/zh-hant/eastern-palace/yowoo-scandal/list?title_no=2549,天神御使緋聞錄,list?title_no=2549,文鐘皓 / 赬㮢 ...,158.5萬,9.34,違反天神規定擅自下凡的神獸們，以及受天神指派為御使而下凡的神獸「翅狐」，他在人間遇上朝鮮第一名妓「初蘭」，因緣際會之下，他們一起結伴並解決各種事件。究竟神獸們會給人間帶來何種混亂？翅狐能否順利完成御使任務呢？
https://www.webtoons.com/zh-hant/city-office/hanriver/list?title_no=3177,漢江禮讚,list?title_no=3177,金8​ ,"219,175",9.56,漢江禮讚——高中同班的四個好朋友，成年后再次聚到了漢江。在她們光鮮亮麗的生活背後，各自隱藏著不為人知的秘密。
https://www.webtoons.com/zh-hant/romance/shadowbride/list?title_no=2825,影子新娘,list?title_no=2825,Sae In Lee / Soo Bean Lim ...,"805,519",9.38,原本想賺還債的錢，卻陷入驚險危機的雪允，面前出現了一名手持神劍「月俒」的渾身是血的武士。雖然對於從絕境中拯救自己的這件事心懷感激，但沒頭沒尾的要求我要伺候他…隔天，在七年戰爭勝利的祝賀遊行中，王世子手中的劍莫名眼熟！「昨晚的男子竟然是王世子？！」
https://www.webtoons.com/zh-hant/city-office/hellomance/list?title_no=2139,地獄羅曼史,list?title_no=2139,Lee Kong-joo / White Eagle ,153.1萬,8.48,前世為惡魔的犯罪者搜查官和人類檢察官的地獄羅曼史！含冤被打入人間的史特利為了見高等惡魔一面，成了一個能最接近惡魔的搜查官，沒想到直屬前輩自私自利、沒教養又沒水準，簡直比身為惡魔的他，更像惡魔…
https://www.webtoons.com/zh-hant/local/blmsn/list?title_no=3427,檳榔美少女,list?title_no=3427,盧卡斯 ,"355,087",9.28,盧修・桑托斯是巴西足球界的明日之星，因為備受矚目與期待，平時除了練球，生活盡被媒體採訪、廣告拍攝、粉絲見面會等行程所填滿，甚至錯失了見到心愛的人最後一面的機會。既傷心又絕望的盧修，決定在世界盃開打當天，消失在無數球迷觀眾面前。他飛越千里，來到大半個地球之外的島嶼台灣，並且遇見了讓四周頓時一片安靜，讓天空的星星像鑽石一樣掉下來的女孩－小葉……
https://www.webtoons.com/zh-hant/city-office/jinwan/list?title_no=3320,今晚哄我入睡吧,list?title_no=3320,Yunana / hepburn ,"285,249",9.00,想聽我的回答嗎？ 那麼9月9日9點來頂樓吧！甘奎莉28年的人生，生平第一次被男人告白的了！但是喝得爛醉的她卻不記得那天向她告白的人是誰…!
https://www.webtoons.com/zh-hant/romance/ending-again/list?title_no=1932,又一次的結局,list?title_no=1932,TARI ,171.3萬,5.59,「戀愛，最終的結局是結婚還是分手？」被交往八年的男友狠狠甩了，決心變成「睡決交」的仁英，卻為了以夫妻名義取得貸款的資格， 拋棄不婚主義，開始驚險又刺激的契約婚姻。
https://www.webtoons.com/zh-hant/local/princess-of-martial-arts/list?title_no=3270,野蠻公主在我家,list?title_no=3270,人桀 ,"252,952",8.31,出身富貴、眾星拱月的「公主」白詩倪，擁有一身不可理喻的蠻橫武力。因不甘願受到後母的擺佈，毅然決然地離家出走，搬進有三個男室友的三合院裡。在面對後母的陰謀、室友的衝突、有生以來首次獨立等眾多壓力下，詩倪是否能靠她的拳頭突破困境呢？
https://www.webtoons.com/zh-hant/city-office/kosan/list?title_no=1003,KOSAN95!,list?title_no=1003,DIDIWALKER ,795.1萬,9.73,你以為KOSAN95只是間普通宿舍嗎? 那你就錯了，每位房客都需要收到邀請才可入住 ，房租及基本費用全都由屋主買單。但，房客需要付出什麼代價呢?一位普通的女孩，蕾娜，將入住這間神祕的套房。
https://www.webtoons.com/zh-hant/eastern-palace/sultanslove/list?title_no=2975,蘇丹之花,list?title_no=2975,chyomchyom / GGONG​ ,353.4萬,8.62,本作品為【官方正式授權】之15歲版本，請讀者們多多支持。「即使所有人都不相信我，妳也必須相信我，莎芮小姐，因為妳是蘇丹的女人，我才決定成為蘇丹的。」上一代的蘇丹兒子–9王「凱內爾」發起了叛亂引起轟動，而一直在蘇丹的後宮隱匿生活、如同一朵嬌弱的花的「莎芮」，在這場危機中存活了下來。生活一直很困難的莎芮，唯一的願望就是能離開後宮到外面的世界，但是成為蘇丹的凱內爾，卻沒有打算放走莎芮，並表明自己是為了莎芮才成為蘇丹的，令莎芮感到相當訝異…​
https://www.webtoons.com/zh-hant/romance/myofficelady/list?title_no=2346,戀上職場姐姐,list?title_no=2346,Wasak basak / JANE ...,481萬,9.70,"在大企業擔當經理(科長級)一職,在公司的TF組遇見了成熟且有魅力的年上女子安經理.她體貼又賢慧,吸引了我….但是,她是個有孩子的女人."
https://www.webtoons.com/zh-hant/romance/mianhuatang/list?title_no=1291,棉花糖女孩的春天,list?title_no=1291,TARI ,"1,766.5萬",8.97,尊嚴、自愛，都不重要! 只要能待在帥哥身邊就好! 非帥哥不愛的棉花糖女孩，崎嶇坎坷的戀愛成長故事。
https://www.webtoons.com/zh-hant/western-palace/shengqishi/list?title_no=2893,女王與聖騎士的戀愛攻防戰,list?title_no=2893,P.J.E / IRinbi​ ,224.7萬,9.07,	「是啊，我成為了王，要把所有想要的東西都弄到手。」篡奪王位後開始侵略鄰國的女王，卡莉歐珮。以聖潔聞名之聖騎士伊載基爾為了阻止戰事的發生而前往阿班西亞德國。他奉國王之命前去阻止戰爭，但在阿班西亞德國等待他的，竟非外交，而是該國的國婿之位⋯⋯殘暴的女王卡莉歐佩與聖騎士伊載基爾，究竟這段並非出自自願的關係，是否能昇華成為愛情呢？
https://www.webtoons.com/zh-hant/western-palace/royalengagement/list?title_no=2116,皇家婚約先保密,list?title_no=2116,KAKON / RYU HEON ,"1,059萬",9.38,我穿越進小說了？但怎麼不是女主角，偏偏是個惡女配角啊！——為了擺脫不幸的命運，她只好先向皇太子提出保密婚約的要求，並暗自下定決心，不要愛上皇太子…她找得到根本的解決之道嗎？
https://www.webtoons.com/zh-hant/adaptation/withantifan/list?title_no=1604,所以我和黑粉結婚了,list?title_no=1604,Jaerim ,"3,936.4萬",9.63,人氣同名改編戲劇於愛奇藝國際站每週五六獨家播出世界級K-POP大明星胡準和極度討厭他的「黑粉」李璟英兩人的同居浪漫羅曼史
https://www.webtoons.com/zh-hant/eastern-palace/immoralnight/list?title_no=2976,悖德之夜,list?title_no=2976,kk / paeng ,188.4萬,7.63,本作品為【官方正式授權】之15歲版本，請讀者們多多支持。​女扮男裝成為少年兵的隱雪，後來嫁給白凰國金刎將軍麒海雲的長子白雲，成為麒海雲的媳婦。某一天，白雲突然離開人世，沒有人知道他真正的死因，守寡的隱雪也被送到麒海雲的府邸。初次見到隱雪的麒海雲還向大眾宣布他將讓隱雪腹中根本不存在的胎兒當繼承人…然後在月光皎潔的夜裡，他來到了她的住所…
https://www.webtoons.com/zh-hant/adaptation/jiangnanmeiren/list?title_no=709,我的ID是江南美人,list?title_no=709,淇萌琪 ,"7,059萬",9.76,從醜八怪搖身化為大美人的女子－姜美來!自小因醜陋的外表慘遭霸凌的美萊終於成功變身! 但她的美卻再度成為眾人的笑柄?面對未知的大學生活，美萊該如何是好?
https://www.webtoons.com/zh-hant/adaptation/shewouldneverknow/list?title_no=2440,前輩，那支口紅不要塗,list?title_no=2440,Cafelatte / JINHA ,374.7萬,8.40,在化妝品公司內，長相帥氣、性感、真摯的直進男後輩，與無視年下男，言辭犀利又能力超群的女前輩，兩人之間推拉心動的浪漫愛情故事。女主角意外得知男友原來是個劈腿渣男，同時面對下屬的直球告白，最後她會怎麼選擇呢？
https://www.webtoons.com/zh-hant/adaptation/quanxilianren/list?title_no=1219,犬系戀人,list?title_no=1219,李惠 ,"3,099.4萬",9.87,為了解開每到凌晨就會變身成狗的詛咒，女主角和害怕狗的男主角展開了一段互相推拉的浪漫愛情故事。
https://www.webtoons.com/zh-hant/adaptation/wufakangju/list?title_no=1549,無法抗拒的他,list?title_no=1549,正瑞 ,"1,011.2萬",9.64,明明知道這是一段不該談的戀愛，明明知道他是一個愛不得的人，但我就是無法克制自己對他的喜歡，無法阻止自己陷下去……令人捉摸不定的他，究竟是中央空調，還是專屬於我的暖男？
https://www.webtoons.com/zh-hant/time-slip/yaoguiwangfei/list?title_no=879,妖鬼王妃,list?title_no=879,蜜蜂 ,"3,149.8萬",9.83,千年才誕生出一位的妖鬼新娘的秘密。愛上異界男人的少女們的心將歸何處，到底誰才是真正的新娘?
https://www.webtoons.com/zh-hant/western-palace/yingjialide/list?title_no=2002,白鹿少女英嘉莉德,list?title_no=2002,Red Parsley ,630.6萬,7.00,社交界最放蕩的浪子—王的庶子，遇上身為名門千金的她！
https://www.webtoons.com/zh-hant/adaptation/myroommate-isagumiho/list?title_no=2556,我的室友是九尾狐,list?title_no=2556,NA ,594.7萬,9.80,人氣改編戲劇《我的室友是九尾狐》愛奇藝國際站 每週三四獨家播出九尾狐辛苦修練900年，好不容易終於可以轉生為人類，卻因一場意外被「她」奪走狐狸珠？為了順利幻化成人，他向母胎單身的她提出同居的邀請....
https://www.webtoons.com/zh-hant/action/xuehong/list?title_no=1902,血紅的白玫瑰,list?title_no=1902,Lim Lina ,"1,803.1萬",9.91,時髦的吸血鬼愛情動作漫畫！
https://www.webtoons.com/zh-hant/romance/guaiguainv/list?title_no=1470,乖乖女的戀愛指南,list?title_no=1470,南琇 ,"5,317.9萬",9.92,過著一板一眼，嚴謹級數最高生活的鄭攸秀，對前輩一見傾心！因此立下了擺脫母胎單身追求真愛的目標，但是...戀愛經驗為零的她，該如何學會撩哥技能?
https://www.webtoons.com/zh-hant/heartwarming/summerbreeze/list?title_no=1707,Summer Breeze,list?title_no=1707,韓景察 ,151.8萬,9.90,"《歐巴, 你不會愛上我吧》韓景察作家的夏季療癒新作！「在不熟悉的地方，再次遇見熟悉的他」，夏日微風暖暖的，讓我想起小時候的故事，這次，我們會擦肩而過，還是會重新開始？"
https://www.webtoons.com/zh-hant/city-office/qinmishu/list?title_no=1474,社長與琴秘書,list?title_no=1474,Limejeongwon / KIRTY ,447.1萬,9.43,大學畢業後成為艱辛打工仔的亞智，某天突然成為了大企業的空降秘書! 而且，她的社長居然是個超級大帥哥! 而她居然與這個社長發生一夜情?! 這到底是怎麼回事啊~?!
https://www.webtoons.com/zh-hant/local/our-bloody-vows/list?title_no=2043,血色的誓約,list?title_no=2043,Haohow ,485.6萬,9.22,曾經墜落人生谷底，後來卻受到網路作家泰德鼓勵而重新振作的熙春，某天，在快要能見到自己偶像的途中，意外邂逅了一位吸血鬼。原本以為逃過一劫的她，卻發現那位吸血鬼竟是自己的學長？？為了能夠回歸正常生活，熙春與吸血鬼的生活就此開始……
https://www.webtoons.com/zh-hant/school/mangnei/list?title_no=1624,忙內禁愛令,list?title_no=1624,GINYU ,442.2萬,9.47,「我哥哥絕對不會同意的！」「我姊姊也不會同意，好嗎？」為了保護家中備受寵愛的弟弟妹妹，哥哥姊姊的跟蹤行徑大公開！
https://www.webtoons.com/zh-hant/eastern-palace/gongzhuweimian/list?title_no=894,公主徹夜未眠,list?title_no=894,Haga ,361.3萬,9.68,中國的杜蘭朵公主擁有令人一見鍾情的美貌，但前來徵婚的對象必須要答對她出的三道謎題。只要答錯了一題，無法結成婚姻還要被斬首示眾。國家被消滅後流亡中的韃靼國王子卡拉富被杜蘭朵的美貌吸引決心挑戰...
https://www.webtoons.com/zh-hant/bl-gl/oh-my-assistant/list?title_no=1808,Oh!我的助手大人,list?title_no=1808,MILA  / AngryMonster ,363.4萬,9.84,成人漫畫家申善浩終於找到助手了！為了能仔細地畫出姿勢(?)，拜託助手擺出POSE讓他參考…善浩到底會和這位美貌和能力兼具的助手擦出什麼樣的火花？兩人的甜蜜搞笑故事即將展開！
https://www.webtoons.com/zh-hant/romance/detide/list?title_no=2074,得體的關係,list?title_no=2074,JQCOMICS / 李鎮永 ,410.9萬,9.38,一直以來只敢偷偷放在心上的那個人意外喪妻。為他痛惜之餘，心中卻冒出小小的期待。等等！我簡直是瘋了！我已經結婚了啊…
https://www.webtoons.com/zh-hant/romance/for-the-sake-of-sita/list?title_no=351,為了西塔,list?title_no=351,Haga ,331.7萬,9.71,命運轉變的少女與曾想拯救她的男子的故事。
https://www.webtoons.com/zh-hant/city-office/gaizaojihua/list?title_no=1522,平凡女孩改造計畫,list?title_no=1522,Lee Yeon ,"3,917.6萬",9.62,從小到大顧著念書、完全不會化妝打扮的睿瑟，某天遇見了正在尋找模特兒的天才化妝師－侑成! 兩個人會擦出什麼樣的火花呢?
https://www.webtoons.com/zh-hant/school/todolist/list?title_no=1362,他和她的距離,list?title_no=1362,RYO. / FLEWing ,805萬,9.62,高個子就會受女生歡迎？那簡直就是『都市傳說』。沒有戀愛經驗的大森一樹是個身形高大的一年級生。某天，附近美術大學一位嬌小的姐姐，讓他陷入了愛河。一齣溫柔、真誠又甜膩的愛情喜劇就此上演。《喜歡上一個人，原來是這樣的感覺啊！》讓我的每一天都是…玫瑰色的！咦？是說愛情該怎麼持續下去呢？每件事都好新鮮、每個舉止都讓人心跳加速，有好多好多全新的發現。本篇將把大家都曾經歷的『愛情的第一次』，以真實故事為基礎，悠緩的描繪出來。
https://www.webtoons.com/zh-hant/bl-gl/bianshen/list?title_no=1519,變身愛情,list?title_no=1519,NAN ,566.9萬,9.45,「如果那是學長喜歡的型，我變就是了！」​鼓起勇氣對仰慕許久的道淵學長告白，但小紅當場被拒絕。這時一名神祕女子接近了絕望挫折的小紅。抱著被騙的心態吃掉神祕女子給的藥之後，小紅變成了道淵學長的理想型「玄」，對道淵學長展開更強烈的求愛攻勢?!對學長一片癡心的玄，會就這麼迎來愛情的Happy Ending嗎?!
https://www.webtoons.com/zh-hant/eastern-palace/jinhunling/list?title_no=1837,禁婚令,list?title_no=1837,Chun Ji hye / 傘冊 ,"1,810.5萬",9.70,膽大包天的算命仙竟敢違抗王朝頒布的禁婚令，四處撮合百姓成婚?! 一場以王作為對象的大騙局該怎麼挽回？
https://www.webtoons.com/zh-hant/romance/sweetenemy/list?title_no=1803,愛上冤家,list?title_no=1803,正允 / 泰建 ,"2,634.1萬",9.68,父母都是罪犯的娟熙為了自立自強，高中一畢業就進入職場，好不容易有能力進入大學讀書，卻遇見一個知道她過去的人…以後的日子究竟會過得如何呢？孤軍奮戰的校園戀愛故事即將展開！
https://www.webtoons.com/zh-hant/romance/buhuiaishangwo/list?title_no=758,"歐巴, 你不會愛上我吧",list?title_no=758,韓景察 ,"4,246.8萬",9.86,平凡的女高中生，加入了五彩繽紛又奇怪的繪畫聚會! 出發去尋找專屬於自己色彩的冒險故事!
https://www.webtoons.com/zh-hant/romance/mylovelyboss/list?title_no=1290,我的偶像總裁,list?title_no=1290,性恩 ,"3,215萬",9.57,描述迷妹南多蘭因迷戀李燦歐爸而將自己的生涯與李燦重疊在一起，應徵進入李燦擁有的公司進而發生的有趣事蹟。
https://www.webtoons.com/zh-hant/romance/untouchable/list?title_no=164,觸不可及,list?title_no=164,massstar ,"6,169.5萬",9.61,模特兒李詩雅是一個必須靠著和人類的身體接觸吸收能量才能夠活下去的現代吸血鬼，擁有美麗外貌的詩雅非常輕易就能夠和男人有身體上的接觸，直到她遇到擁有比任何男人的能量都新鮮的申志浩，李詩雅從第一次和他有了身體接觸後就非常渴望能夠擁有他身上的能量，但這個心願卻因為申志浩的潔癖而失敗，李詩雅為了消滅他的潔癖以及得到他身上的能量一步步地越來越靠近他的生活，但兩人之間卻產生了微妙的感情。 女主角必須和人有身體上的接觸才能活下去，而男主角卻討厭跟任何人有身體上的接觸，這個設定讓讀者在看這部愛情漫畫時更津津有味，李詩雅為了和申智厚有身體上的接觸，採取了各式各樣的作戰方式，雖然看起來像場可愛的鬧劇，不過這個想碰又逃跑的過程就像是男女在曖昧期的不安，作者成功描繪出了在超越友情線前男女間起伏不平的心情。
https://www.webtoons.com/zh-hant/romance/huangtaizifei/list?title_no=1811,皇太子妃101,list?title_no=1811,Menanick / Studio D ,523萬,8.58,「皇太子妃101開幕了！各位，為你的皇太子妃投票吧！」在重生的世界裡開始進行一場大規模皇太子妃選拔賽，但我只是個平凡的配角，這一切都與我無關……個頭啦！我到底為什麼會變成第101位皇太子妃候選人啊？！
https://www.webtoons.com/zh-hant/western-palace/wendyflowershop/list?title_no=1528,非請勿入溫蒂花店,list?title_no=1528,Bize / sizh ,"2,175.6萬",9.59,放下貴族私生女身份，用新名字經營花店的鐵壁女，以及不知道從何時開始在她身邊打轉的鐵壁男-皇室騎士團團長，兩人將展開奇幻的愛情故事。
https://www.webtoons.com/zh-hant/city-office/age-matters/list?title_no=1429,霸氣老闆年下男,list?title_no=1429,Enjelicious ,"1,116.3萬",9.46,充滿戀愛幻想的29歲輕熟女遇上了一位年僅23歲的億萬單身富翁。對戀愛中的人來說，年齡差距真的有那麼重要嗎？
https://www.webtoons.com/zh-hant/romance/my2dbf/list?title_no=1534,我的2D男友,list?title_no=1534,LINE WEBTOON ,421.1萬,9.65,漫畫男主角人氣戀愛男主角們的「心動大合集」！都是你沒看過的小故事喔！
https://www.webtoons.com/zh-hant/local/constellationlovestory/list?title_no=1202,撲倒12星座戀愛祕技,list?title_no=1202,LINE WEBTOON ,258萬,9.55,女性流行內容平台PopDaily與LINE WEBTOON的強力企劃！集結12位畫家詮釋12星座男女的戀愛特性，快來掌握愛情祕技撲倒心儀的他集滿12話愛心，就可抽華納威秀雙人電影票喔！
https://www.webtoons.com/zh-hant/romance/sibaotaiqiuaiji/list?title_no=1136,四胞胎求愛記,list?title_no=1136,炤彛 ,679.2萬,9.14,不知為何人氣爆發的女主角女主，以及同時追求她的四胞胎兄弟。
https://www.webtoons.com/zh-hant/local/diandao/list?title_no=1503,顛倒的戀愛路線,list?title_no=1503,阿嘎 ,913.6萬,9.73,初次見面就不小心求婚？搞笑而荒唐的戀愛過程現在開始！
https://www.webtoons.com/zh-hant/romance/friendsfavoriteperson/list?title_no=1770,朋友喜歡的人,list?title_no=1770,紅音音 / Yamaguchi Shizuka ,348.3萬,7.15,我第一個喜歡上的人，是我很重要的朋友也喜歡的人。
https://www.webtoons.com/zh-hant/romance/women-fenshoule/list?title_no=341,我們，分手了,list?title_no=341,柳彩瞵 ,"1,178.2萬",9.31,一切從分手開始？分手男女的奇妙同居生活~
https://www.webtoons.com/zh-hant/heartwarming/the-stories-of-those-around-me/list?title_no=163,我朋友的故事,list?title_no=163,OMYO ,835.8萬,9.56,正沉浸在熱戀中的夏天、有能力的單身白領美拉、以及跟戀愛五年的男友同居中的正娥，她們三人是25歲的同齡好友。原本平淡無奇，好似永遠不會改變的三人的戀愛狀態，自從美拉的一次相親之後便開始慢慢地發生變化。而正是在這樣的過程中，她們也開始領悟到了愛情的寓意。
https://www.webtoons.com/zh-hant/romance/qiyuenanyou/list?title_no=1529,契約男友是惡魔,list?title_no=1529,jangjin / woombeee ,"2,027.3萬",9.78,無欲無求的人類女孩漢娜，卻突然被找上門的惡魔要求簽下靈魂契約?!
https://www.webtoons.com/zh-hant/romance/nianxiade/list?title_no=2056,年下的戀愛滋味,list?title_no=2056,Na young / seungu ,758萬,9.27,毫無理由就被學長甩掉的仁珠，為了挽回學長找上一起參加志工活動的學弟準備來場戀愛大作戰…不過作戰內容到底是挽回學長還是攻略學弟呢？
https://www.webtoons.com/zh-hant/romance/guixinniang/list?title_no=728,鬼新娘,list?title_no=728,世靜 ,"3,923.3萬",9.73,「吃妳？娶妳？好難決定啊！」突然出現的鬼對少女恩雅說了這句莫名其妙的話。故事將如何發展呢？偶像劇？恐怖片？讓我們一起看下去
https://www.webtoons.com/zh-hant/romance/khouse/list?title_no=1502,花樣 K-HOUSE,list?title_no=1502,泰俊 ,994.4萬,9.50,「看臉時代」作者泰俊的新作品！屋裡的男人，他們不能說的秘密…與花美男們的臉紅心跳同居生活!
https://www.webtoons.com/zh-hant/romance/yinxingdetongju/list?title_no=713,隱形的同居者,list?title_no=713,正瑞 ,"1,261.4萬",9.81,看得見卻摸不著的同居人...人類與幽靈，溫暖中帶著微微涼意的同居生活，正式開始!
https://www.webtoons.com/zh-hant/school/35cm/list?title_no=1463,190的傲嬌,list?title_no=1463,HongGa  ,731.9萬,9.34,155cm的潘河娜和190cm的韓潔，兒時分離的他們現在居然住在一起了？！這對擁有最萌身高差的少男少女之間會發生怎樣的故事呢？
https://www.webtoons.com/zh-hant/romance/imyours/list?title_no=1630,I'm Yours,list?title_no=1630,RoseBean / One Punch Rabbit ,"1,223.6萬",9.75,與曖昧的靈魂展開驚心動魄的同居生活♥某一天，貌似靈魂又不是靈魂的【他】開始來燦陽的家裡找她。因為害怕而躲了好幾天的燦陽，終於鼓起勇氣要面對【他】。但令人意外的是，原來燦陽在陰間欠了他一條命。他要燦陽幫他找出要謀害他的犯人做為代價！燦陽就這樣被迫開始與靈魂同居！
https://www.webtoons.com/zh-hant/time-slip/rebirthgirl/list?title_no=1934,轉世少女,list?title_no=1934,Lee Ji-hun / Han Ah-reum ,160.3萬,8.63,若有一天，你的記憶未被抹去就重生為另一個人，開始新的人生…？因為一場意外而失去性命的18歲女孩將如何改寫人生與愛情？
https://www.webtoons.com/zh-hant/school/danxiao/list?title_no=1757,膽小的調色盤,list?title_no=1757,MINKI ,570.3萬,9.73,性格極其害羞的光娜，連話都不敢大聲說…為擺脫邊緣人的形象，視覺設計系的她加入Palette插畫社，結果入社就遇到了社團危機?! 而校園生活又將帶給她什麼樣的心動的時刻呢?
